canonical_name,place_type,classification,address,locality,province,postal_code,source_label,source_url,verification_status,notes
Arrow Lakes Hospital In-Patient Care Fund,hospital,physical_place,97 1st Avenue NE,Nakusp,BC,V0G 1R0,Interior Health location page,https://www.interiorhealth.ca/locations/arrow-lakes-hospital,verified,Payee alias/fund for Arrow Lakes Hospital; user-provided context confirms this fund corresponds to Arrow Lakes Hospital.
Greater Victoria Hospitals,hospital,rollup_multi_site,,,BC,,Island Health surgical waitlist page,https://www.islandhealth.ca/learn-about-health/surgery/surgical-waitlist,verified,"Rollup/multi-site label; do not map to one point. User-provided context identifies component facilities as Royal Jubilee Hospital (1952 Bay St, Victoria) and Victoria General Hospital (1 Hospital Way, View Royal)."
North Island Hospital,hospital,rollup_multi_site,,,BC,,Island Health Building for Health,https://www.islandhealth.ca/about-us/accountability/strategic-direction/building-health,verified,"Rollup/multi-site label; do not map to one point. Island Health describes the North Island Hospitals Project as two new hospitals: Comox Valley (101 Lerwick Rd, Courtenay) and Campbell River (375 2nd Avenue, Campbell River)."
St. Bartholomew's Hospital,hospital,ambiguous,,Lytton,BC,V0K 1Z0,Interior Health construction projects,https://www.interiorhealth.ca/about-ih/capital-planning-and-projects/construction-projects,needs_review,"Interior Health confirms St. Bartholomew's Health Centre in Lytton was destroyed in the 2021 wildfire and is being replaced, but an authoritative source for the historical hospital/payee address was not found; third-party directories conflict, so no point is assigned."
Tofino General Hospital Inpatient Care Network,hospital,physical_place,261 Neill Street,Tofino,BC,V0R 2Z0,Island Health location page,https://www.islandhealth.ca/our-locations/hospitals-health-centre-locations/tofino-general-hospital,verified,Payee alias/program label for Tofino General Hospital inpatient care network; mapped to the underlying hospital.
Vancouver Hospital - UBC Pavillions,hospital,physical_place,2211 Wesbrook Mall,Vancouver,BC,V6T 2B5,Vancouver Coastal Health location page,https://www.vch.ca/en/location/ubc-hospital,verified,Payee alias/site label for UBC Hospital pavilions; source spelling uses Pavillions and maps to UBC Hospital.
